{
  "schemaVersion": 1,
  "id": "p-rla-library-sunday-hours",
  "title": "Sunday Hours at the Downtown Library",
  "text": "Some city council members argue that the downtown library should extend its hours to include Sunday openings, citing rising weekend foot traffic downtown and requests from working families who can't visit on weekdays. Others argue that Sunday hours would strain an already tight budget and that usage data doesn't yet justify the cost.",
  "textType": "informational",
  "context": "civics",
  "source": {
    "type": "original",
    "attribution": "Original content by Chee Skool"
  },
  "rights": {
    "status": "original",
    "holder": "Chee Skool",
    "note": "Original civic argument practice text created for Chee Skool."
  },
  "evidenceAnchors": {},
  "status": "published",
  "version": 1,
  "author": "Chee Skool",
  "reviewer": "Phase 4B migration review"
}
