{
  "schemaVersion": 1,
  "id": "p-rla-night-shift",
  "title": "The Night Shift",
  "text": "Maria had worked the night shift at the packing plant for six years. She liked the quiet of it — the hum of the conveyor belts, the empty parking lot, the way the sky turned from black to gray just as her shift ended. Her coworkers came and went, chasing daytime hours and better pay, but Maria stayed. She told her sister it was because night shift paid a premium, but the truth was simpler: she had never learned to sleep well in daylight, not since she was a child.",
  "textType": "literary",
  "context": "workplace",
  "source": {
    "type": "original",
    "attribution": "Original content by Chee Skool"
  },
  "rights": {
    "status": "original",
    "holder": "Chee Skool",
    "note": "Original fictional practice passage created for Chee Skool."
  },
  "evidenceAnchors": {
    "preference-details": "She liked the quiet of it — the hum of the conveyor belts, the empty parking lot, the way the sky turned from black to gray just as her shift ended.",
    "real-reason": "She told her sister it was because night shift paid a premium, but the truth was simpler."
  },
  "status": "published",
  "version": 1,
  "author": "Chee Skool",
  "reviewer": "Phase 4 migration review"
}