{
  "schemaVersion": 1,
  "id": "p-rla-last-bus",
  "title": "The Last Bus",
  "text": "Andre usually left the community center before nine, but on Thursday he stayed to help stack chairs after the debate club meeting. By the time he stepped outside, the street was almost empty. He checked the bus app twice, then began walking toward the next stop instead of waiting where he was. When the number 18 finally appeared at the far intersection, Andre stopped walking and smiled.",
  "textType": "literary",
  "context": "community",
  "source": {
    "type": "original",
    "attribution": "Original content by Chee Skool"
  },
  "rights": {
    "status": "original",
    "holder": "Chee Skool",
    "note": "Original fictional practice passage created for Chee Skool."
  },
  "evidenceAnchors": {
    "relief-details": "He checked the bus app twice, then began walking toward the next stop instead of waiting where he was. When the number 18 finally appeared at the far intersection, Andre stopped walking and smiled.",
    "catch-bus-evidence": "He checked the bus app twice, then began walking toward the next stop instead of waiting where he was."
  },
  "status": "published",
  "version": 1,
  "author": "Chee Skool",
  "reviewer": "Phase 4B migration review"
}
